{
  "schema_version": "network-intent-v1",
  "status": "estimated",
  "direction": "client_to_server",
  "family": "talk",
  "intent": "talk",
  "actor_id": "player_demo_01",
  "target_id": "npc_demo_gatekeeper_01",
  "client_seq": 42,
  "idempotency_key": "player_demo_01:42",
  "transport": {
    "kind": "documentation_fixture",
    "tls": "required_outside_loopback"
  },
  "payload": {
    "choice_id": "ask_passage"
  },
  "limitations": [
    "This file is a synthetic documentation fixture, not a captured packet.",
    "Canonical opcodes, framing, serialization, and tick rates remain unavailable.",
    "A matching JSON shape does not prove server compatibility."
  ]
}
